{
  "$schema": "http://json-schema.org/draft-07/schema#",
  "title": "JanusLiveTestPlan",
  "description": "Machine-readable test plan for deterministic Playwright live runner generation",
  "type": "object",
  "required": ["testRunId", "title", "executionMode", "target", "chatWindow", "baseUrl", "backendHealthUrl", "timeouts", "strategies", "tests"],
  "properties": {
    "testRunId": { "type": "string", "pattern": "^TEST-RUN-[0-9]{4}-[0-9]{2}-[0-9]{2}-[0-9]{3}$" },
    "title": { "type": "string", "minLength": 1 },
    "executionMode": { "type": "string", "enum": ["LIVE_VISUAL", "HEADLESS", "LIVE_RETEST"] },
    "target": { "type": "string", "enum": ["JANUS_CHAT", "JANUS_DASHBOARD", "JANUS_ELECTRON", "JANUS_BROWSER_SECURITY"] },
    "chatWindow": { "type": "string", "enum": ["A", "B", "C", "D"] },
    "baseUrl": { "type": "string", "format": "uri" },
    "backendHealthUrl": { "type": "string", "format": "uri" },
    "timeouts": {
      "type": "object",
      "required": ["testCaseMs", "assistantResponseMs", "streamRequestMs"],
      "properties": {
        "testCaseMs": { "type": "integer", "minimum": 1000 },
        "assistantResponseMs": { "type": "integer", "minimum": 1000 },
        "streamRequestMs": { "type": "integer", "minimum": 1000 }
      }
    },
    "strategies": {
      "type": "object",
      "required": ["send", "wait", "evidence", "evaluate"],
      "properties": {
        "send": { "type": "string", "enum": ["chat_window_scoped_send_v1", "chat_button_click_send_v1", "form_request_submit_v1"] },
        "wait": { "type": "string", "enum": ["assistant_stream_complete_v1", "assistant_text_present_v1", "error_toast_v1"] },
        "evidence": { "type": "string", "enum": ["capture_network_v1", "capture_console_v1", "capture_ui_state_v1"] },
        "evaluate": { "type": "string", "enum": ["contains_any_v1", "must_not_contain_v1", "tool_call_detected_v1"] },
        "modelSelection": { "type": "string", "enum": ["model_selection_v1", "model_selection_v2_5"] }
      }
    },
    "parallelization": {
      "type": "object",
      "required": ["enabled", "recommendedWorkers", "defaultWorkers", "mode", "parallelSafeTests", "serialTests", "isolation", "notes"],
      "properties": {
        "schema": { "type": "string" },
        "enabled": { "type": "boolean" },
        "recommendedWorkers": { "type": "integer", "minimum": 1, "maximum": 4 },
        "defaultWorkers": { "type": "integer", "minimum": 1, "maximum": 4 },
        "mode": { "type": "string", "enum": ["serial_only", "mixed_parallel_and_serial", "all_parallel_safe"] },
        "parallelSafeTests": { "type": "integer", "minimum": 0 },
        "serialTests": { "type": "integer", "minimum": 0 },
        "isolation": { "type": "object" },
        "notes": { "type": "array", "items": { "type": "string" } }
      }
    },
    "tests": {
      "type": "array",
      "minItems": 1,
      "items": {
        "type": "object",
        "required": ["id", "name", "type", "provider", "model", "prompt", "expected"],
        "properties": {
          "id": { "type": "string", "minLength": 1 },
          "name": { "type": "string", "minLength": 1 },
          "type": { "type": "string", "enum": ["functional", "intent_routing", "ux", "security", "prompt_injection", "cost_token", "manual_gate"] },
          "provider": { "type": "string", "enum": ["GPT", "Gemini", "Any"] },
          "model": { "type": "string" },
          "parallelSafe": { "type": "boolean" },
          "isolationKey": { "type": "string" },
          "testDataNamespace": { "type": "string" },
          "parallelReason": { "type": "string" },
          "prompt": { "type": "string", "minLength": 1 },
          "expected": {
            "type": "object",
            "properties": {
              "containsAny": { "type": "array", "items": { "type": "string" } },
              "mustNotContain": { "type": "array", "items": { "type": "string" } },
              "responseTimeMsMax": { "type": "integer" },
              "requiresConfirmation": { "type": "boolean" },
              "toolCallExpected": { "type": "string" },
              "tool": { "type": "string" }
            }
          }
        }
      }
    }
  }
}
