{
  "testRunId": "TEST-RUN-2026-05-12-099",
  "title": "BACKLOG-025 verify: catch-block chatWindow interpolation fix",
  "executionMode": "LIVE_VISUAL",
  "target": "JANUS_CHAT",
  "chatWindow": "A",
  "baseUrl": "http://localhost:5173",
  "backendHealthUrl": "http://localhost:8000/health",
  "timeouts": {
    "testCaseMs": 30000,
    "assistantResponseMs": 15000,
    "streamRequestMs": 20000
  },
  "strategies": {
    "send": "chat_window_scoped_send_v1",
    "wait": "assistant_stream_complete_v1",
    "evidence": "capture_network_v1",
    "evaluate": "contains_any_v1"
  },
  "tests": [
    {
      "id": "TC-001",
      "name": "Weather inference - Brauche ich morgen in Muenchen einen Regenschirm? (BACKLOG-025 / BACKLOG-027 verify)",
      "type": "functional",
      "provider": "GPT",
      "model": "gpt-5.4-nano",
      "prompt": "Brauche ich morgen in München einen Regenschirm?",
      "expected": {
        "containsAny": ["Regen", "wetter", "München"],
        "toolCallExpected": "system.weather"
      }
    }
  ]
}
